{
  "schema_version": "1.0",
  "execution_id": "exec_001",
  "run_id": "run_001",
  "task_id": "task_001",
  "action_id": "act_001",
  "state": "pending_approval",
  "attempt_number": 0,
  "idempotency_key": "idem_001",
  "replay_token": null,
  "request_hash": "sha256:req",
  "approval_id": "approval_001",
  "policy_provenance": {
    "bundle_id": "bundle_001",
    "version": "0.2.0",
    "policy_hash": "sha256:abc",
    "environment": "dev",
    "signer_identity": "policy-admin",
    "activated_at": "2026-06-28T00:00:00Z"
  },
  "created_at": "2026-06-28T00:00:00Z",
  "updated_at": "2026-06-28T00:00:02Z",
  "terminal_at": null
}
